user_prompt,output,timestamp
"fale para mim sobre os solos do brasil
","O Brasil é um país com uma grande diversidade de solos, devido à sua extensa área territorial e à variedade de climas e relevo. Segundo a Embrapa (Empresa Brasileira de Pesquisa Agropecuária), o Brasil tem cerca de 1,3 bilhão de hectares de terra, dos quais cerca de 70% são utilizados para a agricultura.

Os solos brasileiros podem ser classificados em diferentes tipos, de acordo com a sua composição química, textura e estrutura. Algumas das principais categorias de solos do Brasil são:

1. Solos Latossólicos: São os mais comuns no Brasil, cobrindo cerca de 40% da área territorial do país. Esses solos são ricos em nutrientes e têm uma boa capacidade de retenção de água, o que os torna ideais para a produção de culturas como soja, milho e café.
2. Solos Podzólicos: São encontrados principalmente nas regiões serranas e montanhosas do Brasil, e são caracterizados por uma camada superficial rica em nutrientes e uma camada inferior mais pobre. Esses solos são ideais para a produção de culturas como café, cacau e frutas.
3. Solos Neossólicos: São encontrados principalmente nas regiões planas e baixas do Brasil, e são caracterizados por uma camada superficial pobre em nutrientes e uma camada inferior mais rica. Esses solos são ideais para a produção de culturas como soja, milho e algodão.
4. Solos Ferráliquidos: São encontrados principalmente nas regiões tropicais do Brasil, e são caracterizados por uma camada superficial rica em nutrientes e uma camada inferior mais pobre. Esses solos são ideais para a produção de culturas como café, cacau e frutas.
5. Solos Gleyicos: São encontrados principalmente nas regiões costeiras e planas do Brasil, e são caracterizados por uma camada superficial pobre em nutrientes e uma camada inferior mais rica. Esses solos são ideais para a produção de culturas como arroz, milho e algodão.

Além disso, o Brasil também tem uma grande variedade de solos ácidos, que são encontrados principalmente nas regiões montanhosas e serranas do país. Esses solos são caracterizados por uma baixa pH e uma falta de nutrientes, o que os torna desafiantes para a agricultura.

É importante ressaltar que a qualidade dos solos brasileiros é afetada por fatores como a erosão, a degradação e a contaminação, o que pode afetar a produtividade e a sustentabilidade da agricultura no país. Portanto, é fundamental implementar práticas agrícolas sustentáveis e conservar a qualidade dos solos para garantir a segurança alimentar e a sustentabilidade do setor agrícola no Brasil.",2025-02-19 20:11:36.721141
